{"$schema":"https://json-schema.org/draft/2020-12/schema","type":"object","additionalProperties":false,"required":["schema","section_id","run_id","refs","nodes","edges"],"properties":{"schema":{"const":"s0-source-transition-index/v1"},"section_id":{"const":"S0"},"run_id":{"type":"string","minLength":1},"refs":{"type":"object","additionalProperties":false,"required":["section_result","section_review","finding_validation","section_bundle","checkpoint","accepted_result"],"properties":{"section_result":{"$ref":"#/$defs/ref"},"section_review":{"$ref":"#/$defs/ref"},"finding_validation":{"$ref":"#/$defs/ref"},"section_bundle":{"$ref":"#/$defs/ref"},"checkpoint":{"$ref":"#/$defs/ref"},"accepted_result":{"$ref":"#/$defs/ref"}}},"nodes":{"type":"array","minItems":1,"items":{"$ref":"#/$defs/node"}},"edges":{"type":"array","items":{"$ref":"#/$defs/edge"}}},"$defs":{"ref":{"type":"object","additionalProperties":false,"required":["path","digest"],"properties":{"path":{"type":"string","minLength":1},"digest":{"type":"string","pattern":"^sha256:[0-9a-f]{64}$"}}},"node":{"type":"object","additionalProperties":false,"required":["node_id","object_ref"],"properties":{"node_id":{"type":"string","minLength":1},"object_ref":{"type":"object","additionalProperties":false,"required":["digest"],"properties":{"digest":{"type":"string","pattern":"^sha256:[0-9a-f]{64}$"}}}}},"edge":{"type":"object","additionalProperties":false,"required":["edge_id","from","to","type"],"properties":{"edge_id":{"type":"string","minLength":1},"from":{"type":"string","minLength":1},"to":{"type":"string","minLength":1},"type":{"enum":["requires","produces","verdict-for"]}}}}}
