{"edges":[{"edge_id":"e0","from":"n19","to":"n18","type":"requires"},{"edge_id":"e1","from":"n18","to":"n0","type":"produces"},{"edge_id":"e2","from":"n18","to":"n1","type":"produces"},{"edge_id":"e3","from":"n18","to":"n2","type":"produces"},{"edge_id":"e4","from":"n18","to":"n3","type":"produces"},{"edge_id":"e5","from":"n18","to":"n4","type":"produces"},{"edge_id":"e6","from":"n18","to":"n5","type":"produces"},{"edge_id":"e7","from":"n18","to":"n6","type":"produces"},{"edge_id":"e8","from":"n18","to":"n7","type":"produces"},{"edge_id":"e9","from":"n18","to":"n8","type":"produces"},{"edge_id":"e10","from":"n18","to":"n9","type":"produces"},{"edge_id":"e11","from":"n18","to":"n10","type":"produces"},{"edge_id":"e12","from":"n18","to":"n11","type":"produces"},{"edge_id":"e13","from":"n18","to":"n12","type":"produces"},{"edge_id":"e14","from":"n18","to":"n13","type":"produces"},{"edge_id":"e15","from":"n18","to":"n14","type":"produces"},{"edge_id":"e16","from":"n18","to":"n15","type":"produces"},{"edge_id":"e17","from":"n18","to":"n16","type":"produces"},{"edge_id":"e18","from":"n18","to":"n17","type":"produces"},{"edge_id":"e19","from":"n2","to":"n0","type":"requires"},{"edge_id":"e20","from":"n2","to":"n1","type":"requires"},{"edge_id":"e21","from":"n2","to":"n3","type":"requires"},{"edge_id":"e22","from":"n2","to":"n4","type":"requires"},{"edge_id":"e23","from":"n2","to":"n5","type":"requires"},{"edge_id":"e24","from":"n2","to":"n6","type":"requires"},{"edge_id":"e25","from":"n2","to":"n7","type":"requires"},{"edge_id":"e26","from":"n2","to":"n8","type":"requires"},{"edge_id":"e27","from":"n2","to":"n9","type":"requires"},{"edge_id":"e28","from":"n2","to":"n10","type":"requires"},{"edge_id":"e29","from":"n1","to":"n0","type":"verdict-for"},{"edge_id":"e30","from":"n14","to":"n7","type":"requires"},{"edge_id":"e31","from":"n15","to":"n8","type":"requires"},{"edge_id":"e32","from":"n16","to":"n9","type":"requires"},{"edge_id":"e33","from":"n17","to":"n10","type":"requires"},{"edge_id":"e34","from":"result","to":"n19","type":"requires"},{"edge_id":"e35","from":"result","to":"n18","type":"requires"},{"edge_id":"e36","from":"result","to":"n11","type":"requires"},{"edge_id":"e37","from":"result","to":"n12","type":"requires"},{"edge_id":"e38","from":"result","to":"n13","type":"requires"}],"nodes":[{"node_id":"result","object_ref":{"digest":"sha256:4b0010abf9f7d78c4adbe8b8e2ed98d642688b685fe99552e926401eac4490ce"}},{"node_id":"n0","object_ref":{"digest":"sha256:abc37c4e16efd0ee2a296bb4571b6e488e86d3d7ac304f95303779fff6be3ce3"}},{"node_id":"n1","object_ref":{"digest":"sha256:f4a268d84ccd2ddae8c886a18f03fb940e4ff62ced6f95a93d9d1169d301799f"}},{"node_id":"n2","object_ref":{"digest":"sha256:d7c2032306d7edcf06a783fc895eddb45e95c47b1c5a570012ec918f74659e64"}},{"node_id":"n3","object_ref":{"digest":"sha256:879d4fee322a2c46abd1421048af0f3609ae2cfe0faba447688562a2aaaa9421"}},{"node_id":"n4","object_ref":{"digest":"sha256:456238826773ec156043c53abc84f58937ff9dd52a795b89829781550f6c45fe"}},{"node_id":"n5","object_ref":{"digest":"sha256:58e5b6f03b4f816ddd53cdeadff3dd30af815ddea5cd39790db9294aee198ce2"}},{"node_id":"n6","object_ref":{"digest":"sha256:9d79bd5f0f55c59550e5c7413bfc59a6af03767f1d5541a4cdd396e7f8f00d03"}},{"node_id":"n7","object_ref":{"digest":"sha256:35e60c21567d26d22ec87a424a2b9e81803ee3648a4e10429e7daef0497281e0"}},{"node_id":"n8","object_ref":{"digest":"sha256:77458375520cc13d039da73d9d96793396e809f8e242ccce3d9f87b5ecaab9ba"}},{"node_id":"n9","object_ref":{"digest":"sha256:b93134efac242540641cb05fa6c6ad51d9889fe73a64fce2a4a9c0004e7381b6"}},{"node_id":"n10","object_ref":{"digest":"sha256:ad621f52929684afeeee018d2f205e8bad6f83276b99d3b057708a1d7261da6b"}},{"node_id":"n11","object_ref":{"digest":"sha256:77c34e72064728be254f2332a1148af9e66dd567bfa573e865f931aed45ab2b5"}},{"node_id":"n12","object_ref":{"digest":"sha256:8a79bd5c9388ab2dab753925b456e6b21748873c7722f0514c0edfb6717e2cd0"}},{"node_id":"n13","object_ref":{"digest":"sha256:73af3196dc5486d96311049beac396889f6caa46a046b12ce9057b50f3036797"}},{"node_id":"n14","object_ref":{"digest":"sha256:d93bbb524c8ea56e1d431cb6f9627ae170a2572ca1d3395e6bf33cad59478f97"}},{"node_id":"n15","object_ref":{"digest":"sha256:96115e6b7c9bff2fdd7e3926664be04b7242df6c24f81eece9ad133c11b033c5"}},{"node_id":"n16","object_ref":{"digest":"sha256:75f27e6e5180614f5fd4b8e6a285ae937b07ecb1325aba0490b55065372e91ed"}},{"node_id":"n17","object_ref":{"digest":"sha256:b111d15f50c0c1f6d610864bf45b893deb045553f6f56d620d4b0e69c222cd6a"}},{"node_id":"n18","object_ref":{"digest":"sha256:0d2e2b0d9ddccf0779769e3208622a8e7aae51e73fd2b392c35b5a75e1932bf3"}},{"node_id":"n19","object_ref":{"digest":"sha256:6425cf29163434fc0282d15315ba684d97790c77918f4869636a66a76139f8de"}}],"refs":{"accepted_result":{"digest":"sha256:d7c2032306d7edcf06a783fc895eddb45e95c47b1c5a570012ec918f74659e64","path":"agent-workflows/evidence/sections/S0/accepted.json"},"checkpoint":{"digest":"sha256:6425cf29163434fc0282d15315ba684d97790c77918f4869636a66a76139f8de","path":"agent-workflows/evidence/sections/S0/checkpoint.json"},"finding_validation":{"digest":"sha256:f4a268d84ccd2ddae8c886a18f03fb940e4ff62ced6f95a93d9d1169d301799f","path":"agent-workflows/evidence/sections/S0/validation.json"},"section_bundle":{"digest":"sha256:0d2e2b0d9ddccf0779769e3208622a8e7aae51e73fd2b392c35b5a75e1932bf3","path":"agent-workflows/evidence/sections/S0/bundle.json"},"section_result":{"digest":"sha256:4b0010abf9f7d78c4adbe8b8e2ed98d642688b685fe99552e926401eac4490ce","path":"agent-workflows/evidence/sections/S0/section-result.json"},"section_review":{"digest":"sha256:abc37c4e16efd0ee2a296bb4571b6e488e86d3d7ac304f95303779fff6be3ce3","path":"agent-workflows/evidence/sections/S0/review.json"}},"run_id":"s0-source-transition-2026-09-04","schema":"s0-source-transition-index/v1","section_id":"S0"}
